{"architecture":"fno2d-v1","batch_normalization":false,"cd_activation":"gelu","cd_head_channels":[68,64,32,1],"cd_pooling":"fluid_masked_mean","coordinate_features":false,"dropout":0,"framework":"nvidia-physicsnemo","framework_version":"2.2.1","input_channels":["sdf_over_reference_diameter","reynolds_affine"],"latent_channels":64,"lifting_channels":[2,64],"model_dtype":"float32","output_channels":["u_mean_normalized","v_mean_normalized","rho_delta_normalized"],"outputs_masked":false,"padding":[8,8],"padding_type":"constant","projection_activation":"gelu","projection_channels":[64,128,3],"retained_modes":[24,24],"schema_version":1,"spatial_shape":[320,256],"spectral_activation":"gelu","spectral_blocks":4}